{
  "$schema": "../../packages/kernel/schemas/plugin.schema.json",
  "type": "plugin",
  "name": "@nanoforge/history-panel",
  "version": "0.1.0",
  "displayName": "History",
  "description": "Every change you can undo: jump to a step, previews, search.",
  "engines": { "editor": ">=0.1.0" },
  "entry": { "client": "index.js" },
  "activation": ["onWidget:history-panel.history"],
  "contributes": {
    "widgets": [
      {
        "id": "history-panel.history",
        "tip": {
          "text": "The steps of what you are working on. Click one to go back to it.",
          "docs": "editor/overview"
        },
        "openByDefault": false,
        "title": "History",
        "icon": "history",
        "defaultSlot": "rightTop",
        "order": 100
      }
    ]
  }
}
